{
  "mosaicConfigFilePath":"./tests/Config/testdata/mosaic.json",
  "auxChainId":1000,
  "originContracts":{
    "baseTokenAddress":"0x9ac77f4c0ca4d0f2142d7a77175cf4f1295fb2d8",
    "valueTokenAddress":"0x8e183Fd2cd55C7C05bBf4FAC989740f69e559A6d",
    "gatewayOrganizationAddress":"0x3f99f42d226A0CD1C1Fcae1e8dC11b2f7a9DcE4B",
    "eip20GatewayAddress":"0xaE02C7b1C324A8D94A564bC8d713Df89eae441fe"
  },
  "auxiliaryContracts":{
    "coGatewayOrganizationAddress":"0x2D586C7E220839a9284888B10aDF4823AcD6EdF3",
    "utilityTokenAddress":"0x62F8729C1C282C231a22252e90CE9735533D2518",
    "eip20CoGatewayAddress":"0xc6fF898ceBf631eFb58eEc7187E4c1f70AE8d943"
  }
}
